id,name,image,text,cooking_time,author_id
1,Домашние сырные палочки,recipes/images/cheese_sticks.jpg,"Простой, но очень вкусный рецепт домашних сырных палочек. Пальчики оближешь! Минимум продуктов и максимум удовольствия, а с приготовлением справится даже ребёнок.",20,1
2,Картофельные пирожки с сосиской,recipes/images/potato_patties_with_sausage.jpg,Нежные картофельные пирожки-зразы с сосиской внутри. Размер пирожка зависит от размера сосиски.,20,4
3,Простой омлет,recipes/images/omlet.jpg,"Иногда нужно что-то быстро приготовить, например на завтрак. Просто яичницу есть не хочется... Именно для такого случая этот рецепт омлета.",10,5
4,Картофельные драники,recipes/images/potato_pancakes.jpg,Очень простой и быстрый рецепт картофельных драников,15,2
5,Ленивые вареники,recipes/images/vareniki.jpg,"Не знаете, что приготовить на завтрак? Предлагаю очень быстрый рецепт ленивых вареников!",10,3